address,lat,lng
嘉定区金园一路1115弄,31.244772,121.319573
嘉定区靖远路1099弄,31.254470,121.324657
嘉定区临夏路98弄,31.258284,121.336736
嘉定区星华公路2173号,31.271646,121.284744
嘉定区榆中路68弄,31.254280,121.325889
嘉定区慈竹路836弄,31.380381,121.212666
嘉定区嘉行公路225弄,31.398669,121.254183
嘉定区首创旭辉城一期,31.412492,121.201108
嘉定区中大街104弄,31.430769,121.216973
嘉定区南翔镇永丰村、新丰村,31.320641,121.301795
嘉定区澄浏中路3128弄,31.386559,121.278352
金山区海盛路515弄,30.755962,121.345236
金山区星火村,30.771869,121.263714
金山区下坊村,30.857740,121.106629
松江区东港村,30.989397,121.199350
松江区银都西路85号,31.082672,121.369270
松江区松东路193弄,31.013446,121.252440
松江区场西路155弄,31.092241,121.343043
松江区长溇村,30.964782,121.286372
松江区青浦区,31.150681,121.124178
松江区北青公路3488号,31.201916,121.251444
松江区乐爱路38弄,31.176300,121.234414
松江区沪青平公路2095号,31.157635,121.262200
松江区奉贤区,30.917795,121.474042
松江区振泰路256弄,30.980532,121.559955
松江区振泰路168弄,30.979565,121.561996
松江区西闸路1118弄,30.994173,121.445110
松江区航谊路8号,30.947364,121.461706
松江区崇明区,31.623587,121.397417
松江区崇明区江南大道,31.368427,121.737819
