address,lat,lng
黄浦区南塘浜路93弄,31.204191,121.474012
浦东新区昌里路93弄,31.176907,121.501932
静安区万航渡路92号,31.2243,121.442752
静安区洛川中路901弄,31.265166,121.450152
松江区沪亭北路901弄,31.152765,121.310825
松江区西林北路890号,31.014666,121.221566
浦东新区瑞建路88弄,31.09626,121.592856
浦东新区创业路87弄,31.142188,121.612661
松江区九亭大街868弄,31.127958,121.317634
浦东新区枣庄路853弄,31.249455,121.582323
虹口区东余杭路827号,31.256163,121.502903
浦东新区瑞浦路81弄,31.092432,121.584671
长宁区天山西路80弄,31.21682,121.374247
静安区陕西北路804号,31.235562,121.449096
静安区彭越浦路800弄,31.285868,121.436166
长宁区仙霞西路7弄,31.208007,121.369831
浦东新区听康路79弄,31.06946,121.7376
静安区王家宅路78号,31.250345,121.472065
浦东新区上南路7888号,31.118302,121.572792
浦东新区金苏路77号,31.259146,121.631346
浦东新区瑞福路77弄,31.096876,121.603221
静安区陕西北路739号,31.234373,121.449957
浦东新区芳华路739弄,31.197025,121.568885
长宁区仙霞西路715弄,31.208764,121.3583
虹口区车站北路715弄,31.296334,121.466047
杨浦区靖宇中路70号,31.285371,121.529238
松江区陈春公路701号,31.073446,121.340819
虹口区飞虹支路69号,31.262318,121.503192
松江区米筛浜路699弄,31.130592,121.21494
浦东新区繁锦路688号,31.313918,121.586272
浦东新区大同路688弄,31.33949,121.575958
虹口区天通庵路663号,31.263798,121.476813
浦东新区上南路6611弄,31.119497,121.553542
浦东新区德州路65弄,31.167041,121.481125
浦东新区南林路658弄,31.138192,121.523633
虹口区天通庵路657弄,31.263595,121.476845
浦东新区浦三路657号,31.187866,121.516873
浦东新区昌里路650弄,31.179138,121.517961
浦东新区浦三路641弄,31.188421,121.516854
浦东新区上南路6393号,31.157498,121.500055
长宁区仙霞西路630弄,31.20978,121.360619
青浦区镇中东路628弄,31.15684,121.215486
虹口区车站北路624弄,31.297563,121.468504
浦东新区上川路620号,31.2738,121.648126
浦东新区首善街619号,30.978929,121.866806
静安区北宝兴路618弄,31.276647,121.461405
浦东新区三林路618号,31.140591,121.503877
浦东新区顺禾路60弄,31.210189,121.527873
浦东新区蓝村路60弄,31.210257,121.529418
浦东新区苗圃路60弄,31.245432,121.545705
浦东新区羽山路600弄,31.232949,121.547086
浦东新区启明村5队庄家宅,30.927169,121.842299
黄浦区方浜西路59号,31.221124,121.482404
浦东新区永泰路59弄,31.135647,121.501827
金山区罗星南路599弄,30.891234,121.168761
松江区沪亭北路596号,31.147661,121.316094
徐汇区龙华西路591弄,31.176378,121.440631
虹口区广粤支路57弄,31.295378,121.465506
虹口区新市南路579弄,31.293529,121.48162
浦东新区龚丰路576弄,31.257885,121.693245
静安区中山北路570弄,31.261193,121.465396
浦东新区牟平路56弄,31.267083,121.596415
浦东新区上浦路565弄,31.147223,121.500633
虹口区江杨南路55弄,31.309516,121.469928
浦东新区龙耀路558号工地生活区,31.162628,121.463181
浦东新区首善街555号,30.975436,121.875106
松江区平阳河路555弄,31.075311,121.266851
浦东新区莲溪路550弄,31.180737,121.56175
浦东新区芳华路53弄,31.194275,121.551463
徐汇区钦州南路531弄,31.158018,121.422461
虹口区吴家湾路52弄,31.292733,121.485926
浦东新区海鹏路529弄,31.288361,121.672279
黄浦区方浜西路51号,31.221231,121.482647
浦东新区民春路516弄,31.27553,121.667626
浦东新区佳虹路50弄,31.266409,121.613454
浦东新区乳山路506弄,31.238323,121.533765
浦东新区和炯路501弄,31.123438,121.507913
浦东新区罗山路5011号,31.164043,121.590709
虹口区车站北路500弄,31.297366,121.473375
松江区横港公路49弄,31.116692,121.261781
浦东新区新龙路489弄,31.31297,121.632646
黄浦区方浜西路47号,31.221249,121.482697
浦东新区思学路470弄,31.297921,121.588313
浦东新区莲园路468弄,31.185312,121.55682
浦东新区永泰路468弄,31.13631,121.512378
黄浦区复兴东路464弄,31.221536,121.495946
黄浦区方浜西路45号,31.221257,121.482727
嘉定区澄浏公路455号,31.41372,121.27365
松江区谷阳北路44号,31.010963,121.236551
杨浦区周家嘴路4460号,31.285757,121.554309
浦东新区川沙路4298号,31.204723,121.693922
静安区天目中路428号,31.243829,121.467167
浦东新区龚华路425弄,31.26147,121.68651
浦东新区溪平路425弄,31.262391,121.689001
长宁区玉屏南路41弄,31.21241,121.410842
浦东新区北中路417弄,31.184528,121.56046
虹口区广灵四路40弄,31.286385,121.481499
浦东新区民同路40弄,31.272825,121.651025
杨浦区大连西路40弄,31.276522,121.497202
浦东新区龚华路406弄,31.260781,121.685816
松江区青城山路400弄,31.126005,121.214836
青浦区金钱公路399号,30.98923,121.499033
浦东新区栏学路398号,31.165183,121.668978
浦东新区拱北路398号,31.057775,121.771459
松江区长施公路398弄,31.110771,121.291418
静安区万航渡路393弄,31.225863,121.436644
金山区茸卫公路389号,30.73574,121.298283
浦东新区书谐路389号,30.942247,121.882548
浦东新区严中路388弄,31.188906,121.532225
徐汇区宛平南路388弄,31.190737,121.446957
浦东新区牟平路384弄,31.261473,121.600215
松江区莘砖公路3825号,31.091778,121.278972
虹口区玉田支路37号,31.281778,121.492455
浦东新区莱阳路3766弄,31.273567,121.580956
杨浦区松花江路36号,31.297392,121.544599
浦东新区红枫路360号,31.241376,121.59155
浦东新区沪南路3601弄,31.109377,121.569606
浦东新区民耀路358弄,31.268652,121.65386
嘉定区丰庄北路355弄,31.249757,121.363998
杨浦区周家嘴路3545弄,31.27801,121.539782
青浦区运河北路353号,30.924622,121.464794
浦东新区金睦路353弄,31.28679,121.674647
青浦区瓦洪公路3396号,30.929679,121.691768
青浦区盈港东路333弄,31.181344,121.295628
浦东新区季景路333弄,31.33413,121.591061
浦东新区拱极路3335弄,31.046083,121.75268
浦东新区鹏飞路330弄,31.172058,121.556755
浦东新区芳华路329弄,31.196251,121.557254
浦东新区浦电路318号,31.220411,121.526462
黄浦区中山南路315号,31.221754,121.504217
杨浦区周家嘴路3158弄,31.275915,121.533278
长宁区富贵东道312号,31.195305,121.40605
长宁区富贵东道306号,31.195205,121.406436
杨浦区杨树浦路3061弄,31.27517,121.555515
虹口区车站西路301弄,31.300008,121.483187
长宁区富贵东道300号,31.195119,121.406825
浦东新区红枫路300弄,31.242246,121.591517
徐汇区南丹东路300弄,31.188651,121.43842
浦东新区园二路299弄,31.317354,121.634392
浦东新区川沙路2977号,31.228567,121.687651
浦东新区德州路295弄,31.167945,121.491372
宝山区国权北路290弄,31.317118,121.494502
浦东新区宣黄路2878弄,31.026697,121.715265
浦东新区杨新路281弄,31.161008,121.488098
浦东新区新陈路280弄,31.179059,121.563201
杨浦区锦州湾路27弄,31.266085,121.536939
长宁区长宁支路279弄,31.225247,121.424235
虹口区四川北路2774弄,31.264426,121.48307
嘉定区金沙江路2735号,31.239646,121.363105
浦东新区沪南路2729弄,31.143111,121.57413
浦东新区沪南路2727弄,31.141737,121.576468
浦东新区安东路270弄,30.962866,121.402909
静安区平型关路265弄,31.270436,121.466227
虹口区松花江路2599弄,31.291839,121.497601
青浦区团汇公路258弄,30.955829,121.508899
浦东新区北园路258弄,31.202854,121.523879
浦东新区秀沿路2585弄,31.138634,121.605544
徐汇区宛平南路255弄,31.193218,121.446903
长宁区万航渡路2505弄,31.219593,121.406375
浦东新区成山路248弄,31.170148,121.498579
浦东新区冬融路246号,31.333069,121.589031
浦东新区沪南路2441弄82支弄,31.152978,121.567444
浦东新区莱阳路2328弄,31.309453,121.584608
长宁区长宁支路231号,31.225918,121.424931
浦东新区川沙路2301弄,31.239896,121.687103
虹口区哈尔滨路229号,31.256303,121.490336
浦东新区川沙路2278弄,31.239148,121.684332
浦东新区张杨路2242弄,31.240921,121.557849
静安区万航渡路223弄,31.225575,121.440792
浦东新区创业路222号,31.212493,121.684984
杨浦区周家嘴路2188弄,31.267792,121.517512
松江区中山二路215号,31.010249,121.227676
静安区共和新路2103弄,31.275857,121.453393
浦东新区德州路20弄,31.169023,121.504653
黄浦区普育东路206号,31.207907,121.495627
青浦区垂姚支路205弄,31.159206,121.213893
长宁区延安西路2055弄,31.2047,121.40949
浦东新区青厦路200弄,31.196994,121.684986
浦东新区博山路200弄,31.244804,121.552681
浦东新区砖桥街1号,31.34408,121.584874
黄浦区高家横弄19弄,31.220741,121.489065
浦东新区潮乐路19弄,30.874514,121.854426
徐汇区宛平南路19弄,31.196746,121.445386
嘉定区曹安公路1993号,31.256727,121.351895
嘉定区星华公路1992号,31.272005,121.289318
浦东新区羽山路1980弄,31.245425,121.569598
浦东新区紫薇路193弄,31.203466,121.61573
浦东新区唐兴路191弄,31.20487,121.650411
嘉定区翔铁东路18号,31.274223,121.334287
浦东新区园洲路189弄,31.31512,121.636217
浦东新区洪山路1889弄,31.15132,121.511258
浦东新区兰谷路1888弄,31.298234,121.592367
虹口区四川北路1851号,31.261413,121.483444
黄浦区金陵东路183号,31.23049,121.48833
浦东新区永泰路182号,31.135875,121.507481
虹口区汶水东路181弄,31.29166,121.485369
杨浦区国顺东路179弄,31.300304,121.53838
杨浦区佳木斯路175弄,31.298425,121.54187
浦东新区北艾路1756弄,31.180152,121.523836
浦东新区成山路171号,31.172884,121.491951
浦东新区建中路171弄,31.202583,121.614501
浦东新区西营路170弄,31.165105,121.484919
浦东新区思浦路16弄,31.158101,121.493891
杨浦区锦州湾路169弄,31.266902,121.538845
浦东新区御桥路1679弄,31.158238,121.567502
浦东新区川黄路165弄,31.191845,121.705417
松江区荣乐西路1635弄,31.015905,121.198603
青浦区朱家角路158弄,31.135477,121.086243
浦东新区观海路1588弄,31.065631,121.783585
浦东新区张杨路1550弄,31.23433,121.541878
浦东新区张杨路1528弄,31.233823,121.539897
松江区沪亭南路151弄,31.124766,121.327818
浦东新区严桥路150弄,31.189416,121.527587
浦东新区金桥路1504弄,31.24975,121.589707
虹口区新市北路1501弄,31.304716,121.481834
浦东新区昌邑路1500弄,31.244384,121.537783
浦东新区东陆路1485弄,31.267878,121.602099
浦东新区浦建路1458弄,31.202365,121.544131
静安区共和新路1453弄,31.266544,121.459348
青浦区南奉公路142号,30.912181,121.635836
松江区沪亭南路1399弄,31.105654,121.340942
黄浦区金陵东路138弄,31.225319,121.49121
浦东新区乳山路138弄,31.235252,121.524106
浦东新区云端路1389弄,30.89107,121.817301
浦东新区长清路136弄,31.168332,121.488762
浦东新区东方路1361号,31.213778,121.529656
浦东新区浦建路135号,31.208651,121.522151
青浦区运河北路1358弄,30.920249,121.439018
浦东新区听悦路1353弄,31.06617,121.736677
青浦区运河北路1351弄,30.91827,121.43947
长宁区长宁支路133弄,31.227012,121.425687
黄浦区瑞金二路132弄,31.210925,121.46588
浦东新区金葵路1315弄,31.240326,121.635223
静安区西藏北路1303弄,31.263486,121.465436
浦东新区海纳路129弄,31.292437,121.671031
松江区中山东路129弄,31.008322,121.260612
浦东新区繁锦路1288弄,31.306133,121.584624
长宁区荣华东道126号,31.195662,121.394386
浦东新区花山路126号,31.344987,121.565514
浦东新区硕川路125弄,31.200309,121.686138
长宁区延安西路1228号,31.20984,121.42784
闵行区虹梅南路1208弄,31.123063,121.424877
静安区共和新路1207号,31.262254,121.461462
浦东新区航昌路119弄,31.075173,121.609403
浦东新区德州路119弄,31.167465,121.489141
松江区广富林路1188弄,31.059471,121.235333
浦东新区沪南路1139号,31.180266,121.556495
浦东新区杨南路1139弄,31.153438,121.510087
浦东新区北艾路1128弄,31.184461,121.534623
黄浦区淮海中路111号,31.2242,121.477805
金山区寺平北路111弄,30.886001,121.31349
浦东新区南泉路1111弄,31.214409,121.523518
静安区谈家桥路110号,31.260411,121.452245
浦东新区笋兴路10号,31.022927,121.643068
杨浦区靖宇中路10号,31.28577,121.529857
浦东新区民雪路108弄,31.274767,121.658404
浦东新区中大街108弄,31.117455,121.578017
浦东新区瑞和路101弄,31.08674,121.58645
黄浦区陆家浜路1018弄,31.211777,121.489181
松江区松金公路10052号,31.000422,121.244773
长宁区中山西路1001号,31.198933,121.414638
浦东新区羽山路1000弄,31.237604,121.557547
青浦区盈中新村,31.152118,121.107528
青浦区庙泾新村,31.143713,121.111284
青浦区三团港村,31.150681,121.124178
长宁区程桥二村,31.189621,121.374448
长宁区程桥一村,31.191707,121.370828
长宁区新泾三村,31.21587,121.370467
长宁区安东小区,31.200276,121.418447
长宁区天山三村,31.214017,121.407346
长宁区天义小区,31.211822,121.407432
金山区石化三村,30.71564,121.337157
金山区石化七村,30.714111,121.348104
金山区滨海一村,30.727956,121.324081
金山区临江北村,30.727786,121.313016
虹口区通海小区,31.259353,121.495231
虹口区玉田新村,31.279671,121.495009
虹口区广中三村,31.278835,121.476323
虹口区商业一村,31.275717,121.476219
浦东新区黄华村,30.974469,121.87951
浦东新区陈桥村,31.174692,121.556697
浦东新区长丰村,31.182775,121.674519
浦东新区西林村,31.136773,121.498532
浦东新区西新村,31.349242,121.529577
浦东新区袁路村,31.0346,121.801163
浦东新区胡桥村,31.039512,121.690396
浦东新区红旗村,31.167657,121.754039
浦东新区环东村,31.186553,121.659235
浦东新区永利村,31.263939,121.69571
浦东新区永丰村,31.215913,121.471481
浦东新区李雪村,30.933524,121.857195
浦东新区明祥苑,31.07264,121.72215
浦东新区新陆村,30.97392,121.832232
浦东新区张唐村,31.267376,121.695036
浦东新区庆星村,31.234509,121.719111
浦东新区富强村,31.031749,121.772902
浦东新区学士村,30.903889,121.78741
浦东新区大杨村,30.970747,121.741791
浦东新区叶桥村,31.080902,121.737569
浦东新区南阜村,31.130224,121.519669
浦东新区北窑村,30.925768,121.853784
浦东新区勤俭村,31.203909,121.724076
浦东新区劳动村,31.179705,121.629564
浦东新区光耀村,31.278219,121.663491
浦东新区东建村,31.020357,121.875927
浦东新区万兴村,30.952923,121.816225
松江区仓吉一村,31.000004,121.216606
杨浦区殷行一村,31.32682,121.542432
杨浦区控江七村,31.282514,121.531742
杨浦区开鲁四村,31.325903,121.530451
杨浦区同济新村,31.283215,121.509872
徐汇区馨宁公寓,31.128045,121.447563
徐汇区滨江小区,31.15248,121.457024
徐汇区安歆公寓,31.17217,121.4015
徐汇区华侨新村,31.180774,121.450395
崇明区前江九队,31.655856,121.598558
黄浦区昼锦路99号,31.224385,121.491132
静安区延长路99弄,31.27449,121.462317
长宁区福泉路99号,31.219998,121.357814
宝山区纬地路99弄,31.324929,121.404861
松江区苍华路999弄,31.168953,121.29142
徐汇区华泾路999弄,31.116152,121.446149
宝山区新二路999弄,31.326895,121.476964
虹口区曲阳路990弄,31.291892,121.490964
虹口区同心路990弄,31.2735,121.4692
松江区长兴路98弄,31.083758,121.275564
嘉定区浩翔路98弄,31.314795,121.312912
杨浦区眉州路988弄,31.270564,121.529695
长宁区长宁路969号,31.21758,121.419321
长宁区虹桥路961弄,31.197492,121.417218
虹口区同心路961号,31.273545,121.469856
静安区平顺路941弄,31.319286,121.455336
虹口区万安路936号,31.300814,121.473428
金山区龙凯街92号,30.731292,121.340515
黄浦区文庙路91号,31.218612,121.489855
普陀区梅川路916弄,31.241224,121.386902
杨浦区长阳路910弄,31.262783,121.521735
静安区南阳路90号,31.228411,121.452283
徐汇区华发路90弄,31.127151,121.453428
松江区虬泾路900弄,31.124604,121.334161
徐汇区虹漕路8号,31.165102,121.41205
黄浦区淡水路89弄,31.22143,121.472977
长宁区宣化路89号,31.217495,121.429152
虹口区衡水路89弄,31.254962,121.486332
松江区德宁路89弄,31.100168,121.25146
青浦区吴塘路899弄,31.1343,121.083654
静安区永兴路896号,31.251337,121.460215
青浦区泽丰路88弄,30.930986,121.489276
青浦区民乐路88弄,30.861638,121.564819
杨浦区学府街88弄,31.300334,121.491075
长宁区仙霞路888弄,31.20726,121.382488
松江区文诚路888号,31.033687,121.212332
长宁区水城路883弄,31.214981,121.390912
虹口区奎照路871弄,31.300216,121.466577
杨浦区包头路870号,31.323592,121.538665
虹口区虹湾路86弄,31.313071,121.474461
杨浦区榆林路858弄,31.259876,121.528636
杨浦区大连路854弄,31.264192,121.50916
虹口区曲阳路851弄,31.290919,121.490257
长宁区虹许路841号,31.1925,121.3895
杨浦区海洲路83号,31.267208,121.545353
长宁区昭化路82号,31.212167,121.427303
杨浦区河间路827弄,31.272088,121.542292
静安区三泉路821弄,31.315517,121.439538
青浦区三元路80号,31.148883,121.110153
黄浦区大林路7号,31.214012,121.487962
黄浦区庄家街79弄,31.219752,121.488849
青浦区吴塘路799弄,31.150681,121.124178
虹口区奎照路791弄,31.300498,121.469009
闵行区金都路788号,31.09327,121.437082
宝山区大华路781弄,31.274302,121.415382
青浦区振泰路76弄,30.98103,121.56373
静安区长乐路764弄,31.217329,121.450501
杨浦区武川路75弄,31.302592,121.492829
青浦区新粮路755弄,31.150681,121.124178
静安区华山路748号,31.214727,121.439345
闵行区颛兴路747弄,31.063555,121.387724
长宁区宣化路72弄,31.218248,121.429757
松江区洞塔路728弄,31.101086,121.238865
虹口区三门路719弄,31.312258,121.48065
徐汇区罗城路700弄,31.149614,121.434441
嘉定区震川路69弄,31.308277,121.157647
杨浦区怀德路694号,31.260445,121.524496
青浦区肖南路68弄,30.958493,121.437754
杨浦区政立路687弄,31.309834,121.500175
青浦区北虹路67号,31.150681,121.124178
长宁区长宁路678弄,31.220454,121.423423
黄浦区高家弄66弄,31.220703,121.489158
虹口区新乡路66号,31.257098,121.481718
静安区柳营路669弄,31.265403,121.455632
松江区洞宁路655弄,31.076251,121.278828
虹口区运光路63弄,31.289967,121.495802
静安区华山路639号,31.216497,121.44076
徐汇区零陵路635号,31.188543,121.446193
黄浦区曹家街62号,31.218627,121.486386
杨浦区平凉路627弄,31.258186,121.524375
长宁区仙霞路620弄,31.205041,121.388938
杨浦区国和路611弄,31.314057,121.521178
青浦区华新街605弄,31.24399,121.221994
杨浦区国和路605弄,31.313249,121.51985
青浦区赵华路601弄,31.150184,121.193875
虹口区山阴路5号,31.265848,121.484818
虹口区场中路591号,31.307446,121.473873
虹口区四平路591号,31.27033,121.496123
松江区云恩路58弄,31.066412,121.218942
静安区凤阳路588弄,31.233363,121.465289
金山区金南街586弄,30.880598,121.167249
虹口区广中路586弄,31.279749,121.466363
虹口区水电路583弄,31.280853,121.47637
杨浦区翔殷路578弄,31.306646,121.534778
虹口区黄山路56号,31.269107,121.47187
杨浦区安波路567弄,31.301181,121.53021
长宁区昭化路555弄,31.211528,121.421284
嘉定区兴顺路555号,31.443939,121.191118
黄浦区高家弄54弄,31.220751,121.488987
杨浦区政和路538弄,31.330728,121.514926
杨浦区港水路52号,31.327106,121.550583
青浦区吴塘路529弄（北区）,30.960603,121.444997
杨浦区邯郸路524弄,31.299524,121.512634
黄浦区庄家街51弄,31.22023,121.488694
静安区安远路515弄,31.237614,121.439895
松江区申港路50号,31.070081,121.355796
徐汇区龙吟路503弄,31.113424,121.452874
黄浦区瞿溪路501弄,31.202762,121.487343
虹口区溧阳路501号,31.252869,121.492385
静安区新疆路500号,31.242435,121.4668
金山区海盛路500弄,30.752477,121.352791
松江区伴亭路500号,31.133254,121.321647
黄浦区静修路49号,31.220088,121.487772
长宁区福泉路495弄,31.20309,121.35998
黄浦区曹家街48弄,31.218869,121.486403
虹口区密云路479号,31.284125,121.496142
长宁区镇宁路465弄,31.22256,121.43368
黄浦区高家弄45弄,31.221094,121.489011
静安区中兴路457号,31.257798,121.474829
青浦区吴塘路457弄,30.961191,121.447461
长宁区仙霞路451弄,31.206309,121.393032
长宁区水城路450弄,31.208953,121.39195
普陀区吉镇路450弄,31.243428,121.37215
长宁区哈密路442号,31.201391,121.3662
杨浦区宁国路438弄,31.266857,121.535382
长宁区福泉路435弄,31.204995,121.358837
徐汇区钦州路428弄,31.166373,121.429647
宝山区美平路428弄,31.389607,121.345616
青浦区杨通路424号,31.150681,121.124178
黄浦区徽宁路419号,31.209878,121.488807
长宁区虹古路419弄,31.202877,121.385602
宝山区韶山路419弄,31.364372,121.364063
长宁区武夷路418弄,31.212581,121.421933
长宁区剑河路414弄,31.21369,121.368761
长宁区剑河路404弄,31.215081,121.368144
长宁区新渔路400弄,31.21755,121.363065
青浦区高泾路399弄,31.161091,121.297369
青浦区盈米路38弄,31.148123,121.091558
静安区康定路388号,31.234545,121.448818
青浦区百富路388弄,30.911457,121.492796
虹口区恒业路388弄,31.265433,121.473271
长宁区虹古路380弄,31.203836,121.389605
松江区德悦路375弄,31.10006,121.255893
虹口区赤峰路373弄,31.281919,121.4885
青浦区国顺路369弄,30.931816,121.458488
松江区文翔路3688弄,31.041863,121.180713
黄浦区自忠路367号,31.218022,121.473636
嘉定区墨玉路362弄,31.299601,121.160237
虹口区飞虹路360弄,31.263676,121.504186
虹口区恒业路360号,31.26593,121.473581
长宁区平武路36-38号,31.208951,121.430368
青浦区青宁路359弄,30.914129,121.550156
虹口区万安路358号,31.301823,121.483818
虹口区凉城路357弄,31.285839,121.469543
黄浦区瞿溪路34号,31.196423,121.471159
黄浦区蓬莱路348号,31.216728,121.48862
虹口区同心路338弄,31.268077,121.474337
闵行区龙吴路3369号,31.093227,121.456188
黄浦区国货路333弄,31.210445,121.493677
虹口区赤峰路333号,31.282128,121.493245
松江区场东路333弄,31.098195,121.358274
黄浦区高家弄32号,31.221062,121.488774
长宁区广顺路32弄,31.216248,121.352624
静安区柳营路328弄,31.267977,121.464799
虹口区虹关路323弄,31.264993,121.496829
虹口区长春路317号,31.262987,121.484949
虹口区玉田路311弄,31.277534,121.494189
黄浦区曹家街30号,31.219061,121.486028
静安区华山路303弄,31.218863,121.44705
长宁区昭化路303号,31.211874,121.425735
杨浦区双阳路303号,31.277729,121.534758
松江区新南街301弄,31.061545,121.316269
杨浦区殷行路301弄,31.326282,121.541652
长宁区安顺路300弄,31.200049,121.411953
杨浦区眉州路300弄,31.261919,121.534982
杨浦区双阳路300弄,31.273522,121.535624
黄浦区打浦路299弄,31.20148,121.472434
长宁区北渔路28弄,31.218348,121.372866
徐汇区华济路28弄,31.116125,121.458994
宝山区德都路28弄,31.403115,121.425506
闵行区航新路288号,31.169416,121.349265
静安区华山路285弄,31.219551,121.446944
静安区升平街27号,31.225176,121.461229
杨浦区国定路277弄,31.29423,121.510385
金山区临桂路2763号,30.7193,121.330169
青浦区古华路272弄,30.908061,121.467358
长宁区番禺路269弄,31.205783,121.429549
青浦区邮电路268弄,30.906489,121.640578
嘉定区丰庄路268弄,31.24426,121.364171
杨浦区平凉路2673号,31.277519,121.555055
青浦区泽丰路262弄,30.930086,121.486012
宝山区水产路2600弄,31.364661,121.442387
闵行区汇延路258弄,31.023642,121.51634
黄浦区大沽路254号,31.225974,121.469423
长宁区新渔路250弄,31.216084,121.367223
黄浦区泰康路248弄,31.208274,121.46873
松江区玉树路2480弄,31.008379,121.209771
青浦区万顺路2476弄,30.966083,121.515743
长宁区虹桥路2419号,31.189116,121.360461
长宁区北渔路23号,31.218678,121.372536
徐汇区斜土路2365弄,31.192673,121.448647
虹口区同心路232弄,31.266763,121.476046
杨浦区政民路230弄,31.302317,121.507672
长宁区长顺路22号,31.197912,121.418487
闵行区万源路2289弄,31.170897,121.386835
青浦区汇龙路227号,31.197302,121.271095
杨浦区内江路222弄,31.279513,121.547673
嘉定区金鼎路2218号,31.259116,121.365401
黄浦区新昌路220号,31.234838,121.468766
杨浦区控江路2200号,31.271472,121.507312
长宁区平塘路215号,31.219008,121.364406
松江区泽悦路211弄,31.101595,121.246025
徐汇区文定路211号,31.18454,121.432856
嘉定区槎溪路20号,31.279213,121.328676
普陀区真北路2087弄52支弄,31.253129,121.390234
长宁区武夷路207弄,31.214027,121.426824
青浦区定康路205弄,30.923421,121.503936
青浦区华强街203弄,31.240397,121.234843
青浦区久远路200号,31.190941,121.108992
长宁区安化路200弄,31.216061,121.426935
嘉定区双坪路200弄,31.405136,121.269962
青浦区新塘路198弄,30.871259,121.465533
嘉定区汇仁路1988号,31.384567,121.164699
虹口区水电路191弄,31.273561,121.474316
虹口区新港路190弄,31.269594,121.500124
长宁区天山路1900号,31.209042,121.414009
杨浦区辽阳路189弄,31.259242,121.516836
长宁区哈密路1896弄,31.195099,121.368628
青浦区金齐路188弄,30.955754,121.498118
长宁区虹桥路1889弄,31.201139,121.386952
杨浦区长阳路1865弄,31.271408,121.537064
静安区新闸路1851号,31.227102,121.442899
闵行区浦秀路183弄,31.072796,121.495555
闵行区鹤翔路180弄,31.047958,121.406685
长宁区金钟路180号,31.219796,121.368839
徐汇区东安路180弄,31.193997,121.452434
杨浦区平凉路1782弄,31.268207,121.544
