address,lat,lng
长宁区蒲淞北路35号,31.218415,121.374741
普陀区中山北路3620弄,31.229463,121.410717
浦东新区芳芯路363弄,31.192188,121.55849
黄浦区制造局路365弄2号,31.206252,121.484935
普陀区中山北路3700弄,31.228239,121.411175
浦东新区严中路373弄,31.189518,121.534488
浦东新区唐兴路373弄,31.205543,121.653462
嘉定区丰庄北路375弄,31.249716,121.364446
浦东新区新川路376号工地生活区,31.148113,121.483879
浦东新区莱阳路3777弄,31.33328,121.582636
松江区江秋潭路377弄,31.12693,121.200365
普陀区中山北路3785号,31.223789,121.410596
黄浦区徐家汇路378号,31.209239,121.474426
宝山区长江西路380号,31.342901,121.476108
黄浦区瑞金二路380号,31.207027,121.466655
普陀区中山北路3856弄,31.226825,121.411427
宝山区苏家浜路388弄,31.363117,121.391328
徐汇区小木桥路388号,31.194379,121.459972
长宁区芙蓉江路388弄,31.215203,121.394447
嘉定区丰庄西路395号,31.24442,121.353785
黄浦区重庆南路39弄,31.221135,121.472278
浦东新区乐城路3弄,31.029977,121.596904
嘉定区曹安公路4058号,31.277373,121.266812
徐汇区肇嘉浜路407号,31.201476,121.457948
黄浦区瑞金二路408号,31.206696,121.467013
嘉定区曹安公路4118弄,31.276381,121.262185
黄浦区四川中路412号,31.239047,121.487551
静安区武宁南路418弄,31.231963,121.432464
浦东新区荣成路41弄,31.241569,121.518446
浦东新区金桥路421弄,31.264233,121.574103
嘉定区翔方公路428弄,31.307338,121.257004
浦东新区孙桥路428弄,31.178989,121.633073
崇明区前哨公路42弄,31.524922,121.874395
浦东新区芙蓉路42弄,31.164088,121.668358
黄浦区浙江中路431号,31.234521,121.481331
徐汇区襄阳南路435号,31.205942,121.458133
奉贤区南奉公路4428号,30.926911,121.548059
普陀区桃浦西路443弄,31.273693,121.390795
杨浦区周家嘴路4440号,31.285467,121.553823
静安区芷江西路453弄,31.257457,121.456742
浦东新区芳华路455弄,31.196577,121.559568
奉贤区奉城东街45弄,30.916392,121.647148
浦东新区周康路461弄,31.113311,121.571633
青浦区华徐公路4638弄,31.23675,121.245968
浦东新区康沈路465号,31.139715,121.571328
宝山区共和新路4701号,31.318171,121.452284
徐汇区龙华西路470弄,31.17735,121.442489
静安区洛川东路470号,31.268732,121.459606
静安区陕西北路470弄,31.230895,121.452926
虹口区西江湾路476弄,31.272539,121.479059
嘉定区丰庄北路477弄,31.249877,121.366646
青浦区北青公路4783弄,31.191258,121.191268
嘉定区曹安公路4800号,31.286759,121.214897
嘉定区丰庄西路480弄,31.246333,121.355684
嘉定区迎园中路485弄,31.38318,121.268249
浦东新区峨山路485弄,31.215156,121.525113
浦东新区平度路488弄,31.252094,121.594906
普陀区交通西路48弄,31.254805,121.448821
嘉定区曹安公路4908弄,31.287111,121.203668
浦东新区海纳路490弄,31.291648,121.670919
嘉定区丰庄北路499弄,31.249536,121.369529
长宁区玉屏南路49号,31.21246,121.410464
静安区陈家宅路49弄,31.264974,121.465775
浦东新区勤奋村4队黄家宅,31.182043,121.57091
浦东新区浦电路5-22号,31.217265,121.517473
徐汇区吴中东路500弄,31.190954,121.422251
静安区平型关路500弄,31.273282,121.46187
浦东新区顾唐路500号工地生活区,31.148113,121.483879
浦东新区蓝村路502弄,31.210556,121.524005
浦东新区龚新路502号,31.257452,121.68248
宝山区新川沙路503弄,31.479047,121.346739
嘉定区德园南路508弄,31.286709,121.314799
黄浦区建国东路50号,31.213597,121.479939
长宁区中山西路515号,31.213897,121.412307
黄浦区广西北路515号,31.23762,121.476263
静安区陕西北路525弄,31.231486,121.452266
宝山区共和新路5288号,31.327333,121.441356
嘉定区西栅桥路528号,31.254743,121.353616
黄浦区瑞金二路52弄,31.21566,121.463925
黄浦区西姚家弄52号,31.222704,121.495651
静安区陕西北路535弄,31.231706,121.452169
黄浦区延安中路535弄,31.223317,121.459843
黄浦区茂名南路53号,31.221677,121.460766
黄浦区西姚家弄53号,31.222478,121.496006
黄浦区淮海中路542弄,31.221146,121.468655
浦东新区塘桥路551弄,31.211733,121.520694
浦东新区莲园路555弄,31.186297,121.559188
静安区共和新路555弄,31.252822,121.463271
黄浦区南车站路555号,31.203754,121.495177
杨浦区延吉东路557弄,31.286581,121.539383
黄浦区徐家汇路558弄,31.207021,121.469597
浦东新区城丰路559弄,31.185709,121.680736
浦东新区川沙路5600弄,31.181727,121.699683
浦东新区康花路56号,31.150234,121.561583
黄浦区茂名南路56弄,31.221446,121.460173
虹口区西江湾路574号,31.274611,121.479609
嘉定区星华公路579号,31.247457,121.303942
青浦区城中西路57弄,31.146418,121.110436
徐汇区陕西南路582弄,31.207062,121.461351
黄浦区复兴中路583弄,31.214801,121.465746
闵行区莲花南路588弄,31.125218,121.422318
静安区中华新路588弄,31.25253,121.462713
浦东新区春源路58弄,31.210098,121.648667
浦东新区银樽路58弄,31.212731,121.647853
虹口区东江湾路590号,31.274714,121.480439
黄浦区黄陂南路596弄,31.215742,121.47649
嘉定区树屏东路599弄,31.413199,121.283271
浦东新区江绣路59弄,31.169952,121.736757
黄浦区西姚家弄59号,31.22252,121.495599
徐汇区徐虹北路5弄,31.190065,121.425357
浦东新区崂山路600号,31.225764,121.52434
嘉定区金园五路601号,31.254333,121.308958
闵行区虹梅南路601弄,31.129229,121.419642
浦东新区新川路603弄,31.191783,121.694548
徐汇区老沪闵路605弄,31.146471,121.427929
黄浦区海南西弄60号,31.210899,121.497038
虹口区四川北路615号,31.264426,121.48307
虹口区大连西路615号,31.276505,121.498447
静安区共和新路619弄,31.254095,121.464976
虹口区大连西路621号,31.274803,121.481227
黄浦区淮海中路622弄,31.220552,121.466377
静安区共和新路625弄,31.254245,121.464464
松江区九亭大街626弄,31.127091,121.324094
静安区延长中路628弄,31.266657,121.448762
虹口区东江湾路62号,31.265735,121.480571
黄浦区四川中路630号,31.242569,121.486249
青浦区章练塘路633号,30.999748,121.062635
长宁区法华镇路635弄,31.206195,121.422001
宝山区国权北路639号,31.327512,121.49608
黄浦区四川中路63号,31.233398,121.489103
黄浦区金陵东路63号,31.231317,121.491061
嘉定区翔方公路650弄,31.308517,121.253284
静安区陕西北路653弄,31.233121,121.45079
浦东新区川周路6561弄,31.166285,121.675317
普陀区金沙江路65弄,31.231157,121.407273
浦东新区新园路65弄,31.319405,121.631766
静安区西苏州路65弄,31.24035,121.452944
长宁区法华镇路660弄,31.205386,121.423107
虹口区大连西路661号,31.274902,121.480322
宝山区水产西路664号,31.356661,121.418858
金山区金石北路6666号,30.871931,121.207918
黄浦区西藏南路666号,31.217291,121.483462
嘉定区华江支路669号,31.264725,121.338626
青浦区崧涟二路66弄,31.139232,121.160143
奉贤区大叶公路6712号,30.978848,121.565997
浦东新区沪南路6733弄,31.173609,121.558102
普陀区延长西路677弄,31.259315,121.427214
嘉定区翔铁东路678号,31.273214,121.339123
青浦区清河湾路67号,31.165792,121.095533
黄浦区西藏南路686号,31.217121,121.483469
浦东新区铃兰路688弄,30.919112,121.916995
黄浦区四川南路68号,31.230331,121.490831
黄浦区建国西路68号,31.208118,121.465634
徐汇区建国西路695弄,31.19992,121.443947
黄浦区淮海中路697弄,31.21872,121.465581
徐汇区虹漕南路699弄,31.149083,121.417975
浦东新区拱乐路699弄,31.063178,121.768505
黄浦区南车站路69弄,31.210994,121.490668
浦东新区通济路6号,31.046109,121.745284
静安区共和新路708弄,31.255246,121.463215
虹口区东江湾路70弄,31.265791,121.480996
长宁区天山西路70号,31.216747,121.374944
虹口区北宝兴路71号,31.271916,121.467259
静安区西苏州路71号,31.241023,121.45195
长宁区法华镇路720弄,31.206436,121.421667
静安区陕西北路721弄,31.234181,121.450198
虹口区车站北路727弄,31.297028,121.465239
静安区延长中路727弄,31.267534,121.446753
静安区共和新路736弄,31.256373,121.462674
松江区荣乐西路758弄,31.018485,121.198118
静安区中山北路758弄,31.259886,121.459696
长宁区娄山关路764弄,31.21199,121.405909
奉贤区沪杭公路768号,30.969653,121.440339
浦东新区梅花路768弄,31.208814,121.554704
宝山区南蕰藻路776弄,31.335629,121.421671
青浦区盈港东路7776号,31.161782,121.155207
黄浦区南京东路789号,31.234443,121.475993
黄浦区西仓桥街7号,31.220276,121.48925
宝山区南蕰藻路800弄,31.336936,121.422817
静安区延长中路800弄,31.265644,121.446299
嘉定区翔方公路801弄,31.306091,121.250219
嘉定区翔黄公路806号,31.275486,121.297439
松江区荣乐中路80弄,31.017288,121.232834
浦东新区崂山路80弄,31.238794,121.515671
静安区谈家桥路80弄,31.261045,121.452199
静安区陕西北路815弄,31.235228,121.4485
黄浦区淮海中路816弄,31.218533,121.461647
青浦区清河湾路819号,31.168,121.102459
嘉定区绿苑支路81号,31.26757,121.21297
普陀区谈家渡路81弄,31.23517,121.422957
嘉定区于塘南路82弄,31.289697,121.193389
黄浦区制造局路833弄10号,31.199269,121.486749
浦东新区云山路835弄,31.253261,121.572287
黄浦区黄陂南路838弄,31.211675,121.476739
嘉定区沪宜公路855号,31.288259,121.304976
浦东新区新川路856号,31.189919,121.6893
浦东新区新川路856弄,31.190543,121.689556
宝山区淞兴西路85号,31.369497,121.491461
长宁区中山西路85弄,31.220569,121.41267
静安区中山北路864号,31.259149,121.456281
青浦区新凤北路866弄,31.252449,121.222421
黄浦区南苏州路877弄,31.24079,121.475492
徐汇区陕西南路888弄,31.20436,121.460826
浦东新区三林路88弄,31.134851,121.494355
浦东新区凌兆路88弄,31.140218,121.492204
浦东新区杜新路88号,31.172297,121.696591
黄浦区河南中路88号,31.232409,121.486895
黄浦区淮海中路899弄,31.217263,121.460611
徐汇区乐山支路8弄,31.196296,121.430893
黄浦区中山南路909号,31.212539,121.506463
普陀区东新支路90弄,31.243123,121.425637
松江区新庙三路916弄,31.056673,121.286406
虹口区新市南路918弄,31.296684,121.480114
徐汇区龙华西路91弄,31.170845,121.453349
浦东新区大同路922弄,31.336451,121.572514
青浦区北青公路9244号,31.186856,121.133907
浦东新区新德路939号,31.194583,121.685644
徐汇区漕溪北路950号,31.182759,121.43602
松江区新春公路951弄,31.069436,121.326219
虹口区新市南路960弄,31.297436,121.480055
松江区松汇中路972弄,31.005595,121.224338
徐汇区龙水北路987号,31.171566,121.447215
浦东新区南桥路988号,31.187865,121.692952
长宁区娄山关路988弄,31.21704,121.40694
松江区谷阳北路98号,31.012286,121.237005
徐汇区南丹东路99弄,31.191342,121.444652
杨浦区国权东路99弄,31.289839,121.525027
长宁区荣华西道99弄,31.194932,121.392864
嘉定区前曹公路9号,31.432847,121.307677
普陀区李子园一村,31.266956,121.38846
杨浦区杨家浜小区,31.28406,121.534016
浦东新区东园四村,31.230122,121.513119
浦东新区卫东新村,31.245251,121.542703
浦东新区鹤鸣二村,31.046658,121.585777
青浦区诸光路工地,31.181764,121.302733
徐汇区中山南二路1023弄,31.179989,121.445519
浦东新区西河浜路116弄,31.19705,121.69826
浦东新区周祝公路1218号,31.106393,121.639305
浦东新区博山东路128弄,31.248198,121.563188
青浦区沪青平公路1357弄,31.169738,121.315041
青浦区沪青平公路1358弄,31.172638,121.315557
青浦区沪青平公路1360号,31.173825,121.309721
浦东新区南六公路1465弄,31.121241,121.695666
青浦区沪青平公路1481弄,31.169013,121.309487
青浦区沪青平公路1509弄,31.171864,121.306476
嘉定区金沙江西路1555弄,31.238189,121.331836
浦东新区灵岩南路156弄,31.15926,121.494344
青浦区沪青平公路1638号,31.173677,121.298394
嘉定区外青松公路164弄,31.359526,121.173635
浦东新区南泉北路170弄,31.236623,121.516092
浦东新区季景北路180弄,31.340656,121.584157
青浦区沪青平公路1818号,31.169941,121.281981
青浦区沪青平公路1881号,31.16454,121.279163
虹口区中山北一路188号,31.273611,121.478216
浦东新区世纪大道1958号工地生活区,31.226917,121.533
浦东新区工农南路196弄,31.046122,121.758258
黄浦区中山南一路198弄,31.200828,121.488531
浦东新区杨高南路1号工地生活区,31.204045,121.528784
浦东新区世纪大道2000号工地生活区,31.218122,121.541621
徐汇区中山南二路2031号,31.177821,121.441632
浦东新区乔家浜路21弄,31.195826,121.703436
浦东新区浦东大道2346号,31.254167,121.556257
杨浦区齐齐哈尔路240弄,31.25719,121.53167
黄浦区中山南一路248号,31.200526,121.48709
浦东新区浦东大道2596号,31.26241,121.566982
虹口区东体育会路29号,31.274415,121.480648
黄浦区中山东一路2号,31.233786,121.49093
浦东新区川北公路3087弄,31.206928,121.613028
浦东新区唐陆公路3200弄,31.210122,121.653162
黄浦区中山东一路32号,31.240881,121.48911
浦东新区唐陆公路3898号,31.19983,121.660983
浦东新区川周公路4005号,31.12584,121.588682
浦东新区龙东大道4028弄,31.224251,121.654961
嘉定区古猗园南路450号,31.285834,121.319535
浦东新区高科东路500弄,31.210851,121.653296
黄浦区中山东二路538号,31.227842,121.496644
浦东新区沪南公路5559号,31.026072,121.600111
浦东新区环庆中路57号,31.23378,121.721198
浦东新区张杨北路5911弄,31.348877,121.572099
浦东新区东城壕路62弄,31.193873,121.696954
浦东新区通源东路66号,31.005121,121.892139
浦东新区西营南路67弄,31.158169,121.485388
虹口区东体育会路70弄,31.27442,121.481258
虹口区东体育会路75号,31.274218,121.481009
浦东新区新环西路777弄,31.025475,121.639139
浦东新区宣镇东路785弄,31.02441,121.700575
浦东新区宣镇东路788弄,31.023729,121.702251
嘉定区黄家花园路800号,31.267456,121.321246
奉贤区川南奉公路8060弄,30.940273,121.723673
虹口区东体育会路83号,31.273769,121.481765
虹口区东体育会路87号,31.273645,121.481515
黄浦区中山南一路904号,31.196458,121.475787
青浦区重固镇大街981弄,31.20039,121.185389
浦东新区南街小湾村,31.228227,121.690126
浦东新区唐镇虹二村,31.235958,121.680677
浦东新区宣桥光明村,31.079631,121.718627
浦东新区川沙陈家宅,31.184568,121.655874
黄浦区制造局路后街26号,31.210219,121.482297
宝山区一二八纪念路811弄,31.326122,121.449298
嘉定区宝翔路小学工地,31.345834,121.265466
浦东新区七灶村冯家宅,31.137968,121.723782
浦东新区三林镇王家渡,31.123687,121.476483
浦东新区下沙街北桥弄,31.049742,121.592956
浦东新区东风村奚家宅,31.156231,121.550453
浦东新区五四村孙家宅,31.254707,121.65062
浦东新区五四村沈家宅,31.254258,121.655141
浦东新区六灶湾勤俭村,31.01114,121.772769
浦东新区六灶镇果园村,31.019684,121.635892
浦东新区共和村张家宅,31.170976,121.733536
浦东新区军民村冯家宅,31.137968,121.723782
浦东新区前哨村倪家宅,31.24296,121.731512
浦东新区前哨村包家宅,31.199742,121.757992
浦东新区前锋村黄家宅,31.280139,121.689291
浦东新区北蔡镇黄家宅,31.182043,121.57091
浦东新区华星村顾家宅,31.204419,121.715223
浦东新区向东村谈家宅,31.233344,121.743897
浦东新区向东村龚家宅,31.226022,121.716438
浦东新区周浦镇东八灶,31.115533,121.581733
浦东新区唐镇东龚家宅,31.161143,121.646659
浦东新区唐镇北张家宅,31.140287,121.705554
浦东新区大众村唐家宅,31.161386,121.582882
浦东新区大众村西沟圈,31.228785,121.651438
浦东新区大星村凌家宅,31.216495,121.726829
浦东新区大星村奚家宅,31.156231,121.550453
浦东新区大星村尹家宅,31.045981,121.811829
浦东新区大星村张家宅,31.217604,121.68654
浦东新区大星村林家宅,31.222013,121.72174
浦东新区川沙南朱家宅,31.143075,121.7227
浦东新区康悟路太平村,31.121927,121.553355
浦东新区建光村倪家宅,31.212753,121.746966
浦东新区建光村蔡家宅,31.078007,121.798289
浦东新区新光村陆家宅,31.257982,121.657374
浦东新区新华村薛家宅,31.179537,121.518502
浦东新区新星村胡家宅,31.250502,121.730803
浦东新区新浜村顾家宅,31.124509,121.73974
浦东新区新生村叶家宅,31.177725,121.738355
浦东新区曹路镇徐家宅,31.24937,121.73093
浦东新区朝阳村徐家宅,31.250085,121.734824
浦东新区杜坊村宋家宅,31.026394,121.860297
浦东新区杨桥村金家宅,31.125041,121.586719
浦东新区民众村运河西,31.276332,121.670796
浦东新区民建村徐家宅,31.271214,121.650686
浦东新区民建村曹家宅,31.272754,121.649894
浦东新区民建村梅家宅,31.272754,121.649894
浦东新区民建村金家宅,31.125041,121.586719
浦东新区永丰村徐家宅,31.251583,121.687464
浦东新区永利村徐家宅,31.251583,121.687464
浦东新区永利村朱家宅,31.266595,121.700511
浦东新区永利村马家宅,31.263939,121.69571
浦东新区永和村周家宅,31.263936,121.695709
浦东新区永和村新西宅,31.262218,121.696846
浦东新区沔北村顾家宅,31.167577,121.634383
浦东新区沪东新村小区,31.271033,121.582324
浦东新区浦三路何家宅,31.160441,121.533049
浦东新区海塘村顾家宅,31.212063,121.756635
浦东新区界龙村华家宅,31.161758,121.659282
浦东新区界龙村沈家宅,31.169644,121.682455
浦东新区界龙村费家宅,31.157575,121.743493
浦东新区胡巷村孙家宅,30.999036,121.851381
浦东新区艾南村何家宅,31.171776,121.519466
浦东新区蔡路村吴家宅,31.179955,121.631647
浦东新区虹四村卫家宅,31.240544,121.657179
浦东新区迅建村季家宅,31.190182,121.570951
浦东新区迅建村黄家宅,31.280139,121.689291
浦东新区顾东村胡家宅,31.293138,121.661376
浦东新区顾东村顾家宅,31.293138,121.661376
青浦区五厍浜路乾寿街,31.144383,121.108489
浦东新区东滨村东张家宅,31.214952,121.720438
浦东新区前锋村夹路村宅,31.271928,121.695098
浦东新区勤俭村东张家宅,31.214952,121.720438
浦东新区华星村西宋家宅,31.245846,121.681499
浦东新区友谊村东凌家宅,31.347199,121.575477
浦东新区启明村小杨家宅,31.276764,121.694654
浦东新区启明村小秦家宅,31.278179,121.690437
浦东新区和平村北朱家宅,31.141837,121.760618
浦东新区大众村小包新村,31.232079,121.647107
浦东新区新光村姜薛家宅,31.261461,121.662123
浦东新区新春村西王家宅,31.160996,121.686979
浦东新区新春村赵孟家宅,31.15894,121.69344
浦东新区栏杆村曹顾家宅,31.176218,121.664658
浦东新区栏杆村龚陈家宅,31.184568,121.655874
浦东新区永乐村西绍家弄,31.077639,121.75879
浦东新区界龙村吴陆家宅,31.178088,121.678753
浦东新区界龙村徐顾家宅,31.180117,121.676793
浦东新区界龙村黄范家宅,31.175879,121.68329
浦东新区益民村西周家宅,31.220096,121.716101
浦东新区纯新村南王家宅,31.133263,121.528135
浦东新区道新村南金家宅,31.159083,121.760528
浦东新区邓三村南朱家宅,31.143075,121.7227
浦东新区长丰村北张家宅,31.140287,121.705554
浦东新区陈胡村沈徐家宅,31.189765,121.779136
浦东新区陈行村西陈家宅,31.09216,121.498391
浦东新区永红村丁家宅二队,31.234282,121.705501
浦东新区环东中心村顾家宅,31.179506,121.643934
静安区西藏北路赵家宅乙弄13号,31.260195,121.467043
嘉定区槎溪路金通路路口工地,31.286986,121.323573
浦东新区三林村南行队翁家浜,31.131762,121.504246
浦东新区临江村张塘队塘湾宅,31.125261,121.487709
浦东新区临江村益民队泰保堂,31.118906,121.478659
浦东新区三林镇高树队西汤家宅,31.142739,121.511156
浦东新区临江村王家宅队王家宅,31.166252,121.680159
浦东新区天花庵村闵东队闵家宅,31.120611,121.534081
浦东新区杨桥村蒋家队北季家宅,31.19342,121.573136
浦东新区花庵村东瞿队大瞿家宅,31.121437,121.525726
浦东新区花庵村西瞿队大瞿家宅,31.121437,121.525726
浦东新区天花庵村南周家队大周家宅,31.122769,121.534302
嘉定区陈翔公路浩翔路中央公园地下室,31.311628,121.316226
嘉定区园大路园福路交叉口上海城投工地,31.252374,121.5225
浦东新区银峰路龚华路交界口工地生活区,31.204722,121.548595
浦东新区镇北路银峰路交界口工地生活区,31.269341,121.6885
浦东新区丁香路世纪大道交界口工地生活区,31.204722,121.548595
浦东新区周家渡路博成路交界口工地生活区,31.204722,121.548595
浦东新区环业西路五星路交界口工地生活区,31.175415,121.567331
奉贤区星火19连,30.859873,121.570002
奉贤区东门村,30.917355,121.663649
奉贤区二桥村,30.958692,121.653864
奉贤区光明村,30.911398,121.505881
奉贤区光辉村,30.9922,121.581332
奉贤区军民村,30.896373,121.450677
奉贤区冯家村,30.955272,121.640655
奉贤区北唐村,30.928126,121.575531
奉贤区北宋村,30.984574,121.688999
奉贤区北新村,30.92738,121.44292
奉贤区南宋村,30.966189,121.675118
奉贤区南胜村,30.859152,121.48077
奉贤区南行村,30.973836,121.510179
奉贤区南街村,30.91138,121.644614
奉贤区南陈村,30.967782,121.547841
奉贤区卫季村,30.904089,121.606158
奉贤区发展村,30.965685,121.431814
奉贤区吴塘村,30.959077,121.412363
奉贤区四团村,30.941389,121.71156
奉贤区团南村,30.940228,121.716677
奉贤区墩头村,30.980703,121.616743
奉贤区夏家村,30.966661,121.728394
奉贤区大门村,30.894053,121.610622
奉贤区工农村,30.91182,121.536727
奉贤区幸福村,30.934613,121.653301
奉贤区庄北路,30.907488,121.390811
奉贤区张弄村,30.907426,121.522392
奉贤区护民村,30.891762,121.635452
奉贤区拾村村,30.946388,121.745899
奉贤区新寺村,30.859192,121.461751
奉贤区曙光村,30.904357,121.491047
奉贤区朱墩村,30.891866,121.596508
奉贤区朱店村,30.919581,121.554326
奉贤区李窑村,30.913408,121.591776
奉贤区柘林村,30.838151,121.471041
奉贤区梁典村,30.963714,121.598204
奉贤区梅园村,30.990492,121.597016
奉贤区沈陆村,30.894654,121.453423
奉贤区浦秀村,30.982166,121.403989
奉贤区灯民村,30.906503,121.635785
奉贤区红庄村,30.897864,121.725554
奉贤区红旗村,30.942045,121.634262
奉贤区联民村,30.873689,121.65094
奉贤区花厅村,30.952116,121.620764
奉贤区西吴村,30.945408,121.580842
奉贤区西校村,30.935186,121.403047
奉贤区解放村,30.901102,121.536844
奉贤区邵靴村,30.895742,121.770154
奉贤区郊南村,30.832376,121.471068
奉贤区金海村,30.872002,121.501393
奉贤区金王村,30.879439,121.541211
奉贤区钱忠村,30.882308,121.546764
奉贤区长堰村,30.82754,121.391513
奉贤区陈桥村,30.923652,121.613774
奉贤区集贤村,30.915577,121.6966
奉贤区高桥村,30.91496,121.631724
奉贤区政旭路1058号,30.917795,121.474042
奉贤区正旭路1058号,30.881866,121.748017
奉贤区镇西路1058号,30.917795,121.474042
奉贤区明城路1088弄,30.853522,121.561425
奉贤区青伟路111号,30.932979,121.604257
奉贤区奉陆路1198号,30.943742,121.607771
奉贤区平福路1210弄,30.897304,121.736511
奉贤区肖南路1268号,30.93127,121.445713
奉贤区洪庙路126弄,30.926396,121.688285
奉贤区北环路1288号,30.960016,121.377194
奉贤区育秀路1288弄,30.906889,121.451129
奉贤区光大路12号,30.912623,121.589834
奉贤区星中路131号,30.860039,121.568712
奉贤区九华路1338弄,30.92217,121.440931
奉贤区立新路136弄,30.91429,121.460302
奉贤区闸园路136号,30.991434,121.432042
奉贤区水闸路14弄,30.922914,121.681412
奉贤区望园路1526号,30.956231,121.474985
奉贤区博丰路158弄,30.964237,121.496383
奉贤区正环路158弄,30.912244,121.479929
奉贤区泰叶路159弄,30.977679,121.561081
奉贤区福光路160弄,30.921085,121.520624
奉贤区海光路168弄,30.858131,121.571556
奉贤区韩村路173弄,30.940333,121.462456
奉贤区兰博路1801弄,30.907693,121.65658
奉贤区正博路1881号,30.876618,121.749763
奉贤区邮电路188号,30.907616,121.641334
奉贤区金齐路188弄,30.955754,121.498118
奉贤区金碧路1980弄,30.971468,121.508358
奉贤区新塘路198弄,30.871259,121.465533
奉贤区湖堤路199弄,30.935309,121.493402
奉贤区邵平路1号,30.907104,121.756813
奉贤区万顺路2088弄,30.958066,121.517665
奉贤区育秀路209号,30.908744,121.465714
奉贤区国顺路218弄,30.933797,121.464508
奉贤区万顺路2278弄,30.962878,121.518268
奉贤区万顺路2476弄,30.966083,121.515743
奉贤区洪庙路247弄,30.926583,121.692351
奉贤区贤百路260弄,30.953498,121.514991
奉贤区泽丰路262弄,30.930086,121.486012
奉贤区邮电路268弄,30.906489,121.640578
奉贤区古华路272弄,30.908061,121.467358
奉贤区泰青路278号,30.982567,121.564533
奉贤区德政路299弄,30.921874,121.483535
奉贤区金齐路348弄,30.954213,121.492535
奉贤区青宁路359弄,30.941939,121.515998
奉贤区嘉园路361弄,30.959599,121.493706
奉贤区扶港路388弄,30.990473,121.441412
奉贤区百富路388弄,30.911457,121.492796
奉贤区湖堤路399弄,30.935002,121.492523
奉贤区杨通路424号,30.894537,121.489103
奉贤区吴塘路457弄,30.961191,121.447461
奉贤区市场路46弄,30.942316,121.728221
奉贤区清宁路488弄,30.942332,121.511378
奉贤区振泰路51弄,30.979301,121.563926
奉贤区吴塘路529弄（北区）,30.960603,121.444997
奉贤区北行路555号,30.970996,121.507452
