address,lat,lng
闵行区虹梅南路2509号,31.097805,121.433011
闵行区虹梅南路2517号,31.097492,121.433096
闵行区虹梅南路2519号,31.097479,121.433098
浦东新区苗圃路251号,31.24149,121.548115
闵行区红松东路251弄,31.188543,121.40741
闵行区虹梅南路2541号,31.097079,121.433241
闵行区虹梅南路2547号,31.096995,121.433324
嘉定区嘉唐公路2551弄,31.461394,121.240561
宝山区祁北东路256号,31.421849,121.349372
浦东新区新华路25号,31.048557,121.756271
虹口区广中支路25号,31.273136,121.475663
虹口区西江湾路264弄,31.268304,121.478053
杨浦区靖宇东路266号,31.289138,121.535574
闵行区莲花南路2689号,31.065673,121.431264
徐汇区肇嘉浜路269号,31.202593,121.46229
松江区新车公路281号,31.032482,121.305269
浦东新区罗山路2855号工地生活区,31.156877,121.566928
闵行区三鲁公路2875号,31.073625,121.523934
虹口区东宝兴路288号,31.258227,121.481234
闵行区莲花南路2899号,31.063218,121.4335
宝山区东电台路28号,31.378869,121.367128
虹口区车站南路28号,31.294784,121.482835
宝山区牡丹江路290弄,31.37932,121.495841
松江区松汇东路291弄,31.002668,121.242958
徐汇区龙水南路294号,31.154066,121.457305
松江区同乐南路2号,31.076882,121.271426
松江区荣乐中路2弄,31.019929,121.241831
浦东新区川图路300号,31.154452,121.708233
宝山区祁北东路301号,31.428967,121.372017
浦东新区杨思路301弄,31.159243,121.489404
浦东新区樱花路309弄,31.206463,121.550193
静安区陕西北路30弄,31.224311,121.4572
普陀区延长西路318弄,31.262381,121.437128
浦东新区唐镇路321弄,31.209435,121.653721
闵行区沈杜公路3235号,31.062522,121.524367
浦东新区南园路327弄,31.027485,121.747985
黄浦区北京西路329号,31.235068,121.467675
闵行区伊犁南路32弄,31.190275,121.404079
黄浦区先棉祠街32弄,31.217087,121.491552
静安区成都北路330号,31.22714,121.46679
宝山区殷高西路333号,31.320703,121.472294
浦东新区芦潮路333弄,30.8638,121.85894
浦东新区东方路3391弄,31.190896,121.513873
浦东新区栏学路339号,31.16762,121.668551
闵行区三鲁公路3419号工地,31.076325,121.523102
浦东新区鹤洁路346弄,31.069174,121.603497
浦东新区川沙路3488号,31.219017,121.689206
松江区昆港公路3498号,31.033733,121.140249
浦东新区雪野路34弄,31.182586,121.496995
闵行区横泾东路35号,31.112813,121.381709
徐汇区田林东路360号,31.173983,121.42924
长宁区法华镇路363弄,31.203976,121.428128
黄浦区复兴东路368号,31.221176,121.497412
黄浦区河南南路368号,31.224,121.488463
黄浦区方浜中路373号,31.225089,121.49041
静安区王家宅路37弄,31.250978,121.472653
静安区陕西北路37号,31.224471,121.45652
静安区彭浦新村385号,31.310067,121.4534
虹口区东汉阳路388弄,31.251195,121.495323
浦东新区新龙路389弄,31.313146,121.631371
黄浦区四川南路38号,31.230682,121.490603
黄浦区方浜西路38弄,31.221644,121.482869
浦东新区秀浦路3999弄,31.134535,121.633518
浦东新区渔港路399弄,30.866298,121.851313
虹口区东汉阳路399弄,31.251195,121.495323
虹口区中山北路39号,31.26759,121.472323
虹口区长春支路3号,31.260771,121.486593
黄浦区徐家汇路3号,31.21095,121.481707
浦东新区川沙路4088号,31.208131,121.692363
虹口区东汉阳路408号,31.251744,121.496503
浦东新区青桐路409弄,31.214755,121.623168
黄浦区天柱山路40号,31.210777,121.492498
黄浦区瑞金二路40弄,31.216973,121.464327
虹口区东汉阳路412号,31.251771,121.496551
黄浦区浙江中路417号,31.236415,121.47766
浦东新区川沙路4197号,31.206423,121.694118
宝山区聚丰园路425号,31.314773,121.379013
杨浦区周家嘴路432号,31.276446,121.535647
浦东新区上南路4362弄,31.142082,121.510688
徐汇区天钥桥路438号,31.187218,121.441939
黄浦区江西中路438号,31.241399,121.485346
浦东新区浦三路4399号工地生活区,31.130605,121.548844
黄浦区浙江中路439号,31.23645,121.477341
闵行区环镇西路440号,31.17726,121.390667
普陀区桃浦西路441弄,31.273513,121.390601
虹口区东江湾路444号,31.27088,121.480438
杨浦区周家嘴路4450号,31.285541,121.554048
浦东新区春晖路445弄,31.337132,121.582933
黄浦区江西中路457号,31.241846,121.484992
松江区南其昌路458弄,31.024857,121.22621
静安区共和新路4605弄,31.316733,121.448894
静安区共和新路4618弄,31.31655,121.447009
静安区中华新路469号,31.254295,121.466285
普陀区怒江北路490号,31.236137,121.389634
虹口区东汉阳路490号,31.252432,121.497756
长宁区法华镇路500弄,31.204436,121.426022
浦东新区上浦路505弄,31.147274,121.498965
徐汇区襄阳南路514弄,31.204552,121.457888
黄浦区海南西弄51弄,31.211115,121.497367
虹口区新市南路533弄,31.29215,121.483029
闵行区三达支路537弄,31.07254,121.518915
虹口区新市南路546弄,31.293006,121.480496
浦东新区潍坊路54号,31.226095,121.527254
黄浦区海南西弄54号,31.210891,121.497222
长宁区法华镇路555号,31.205607,121.424197
闵行区三鲁公路5569弄,31.119466,121.508637
虹口区江扬南路55弄,31.309056,121.471848
静安区西藏北路573弄,31.252042,121.468374
黄浦区方浜西路57号,31.221165,121.482546
浦东新区康涵路58弄,31.116329,121.546449
黄浦区先棉祠街59号,31.217388,121.490983
浦东新区鹤韵路601弄,31.075993,121.595932
浦东新区峨山路608号,31.214046,121.522068
虹口区东长治路609弄,31.248681,121.495205
闵行区北松公路609号,31.037741,121.399004
闵行区金汇南路60弄,31.17137,121.379286
虹口区大连西路617号,31.274647,121.480891
黄浦区蒙自西路62弄,31.207437,121.475571
浦东新区上南路6399号,31.119361,121.548058
浦东新区花木路63号,31.210653,121.542628
黄浦区方滨西路63弄,31.22075,121.482187
闵行区程家桥路64号,31.186425,121.373722
浦东新区胶东路657弄,31.259347,121.59824
浦东新区听和路65弄,31.057206,121.748282
黄浦区方浜西路65号,31.221146,121.482389
虹口区天通庵路666弄,31.263967,121.476552
普陀区南石四路66号,31.248671,121.40646
浦东新区创业路66弄,31.145597,121.610732
虹口区汶水东路670号,31.289791,121.474899
静安区陕西北路670号,31.233746,121.451214
浦东新区和龙路685号,31.35011,121.568452
虹口区汶水东路690弄,31.288799,121.473635
黄浦区复兴东路690号,31.221643,121.492225
黄浦区西藏南路699号,31.217711,121.484666
浦东新区乐园路6号,31.275981,121.605017
宝山区莲花山路700弄,31.361724,121.43735
黄浦区黄陂南路700号,31.214126,121.476765
徐汇区龙华中路701号,31.184814,121.457
虹口区车站北路708号,31.297338,121.467009
嘉定区浏翔公路7108弄,31.471159,121.282722
浦东新区东亭路715弄,31.181679,121.754286
长宁区黄金城道717弄,31.194659,121.399083
浦东新区晨晖路725号,31.200386,121.595315
静安区茂名北路73弄,31.228909,121.45856
静安区茂名北路75弄,31.225014,121.46011
松江区涞亭北路761号,31.157389,121.324719
浦东新区崮山路762号,31.238402,121.560208
浦东新区海阳路779号,31.157365,121.500456
浦东新区新德路785弄,31.195281,121.687228
松江区石湖新路78号,30.985335,121.12013
虹口区长春支路7号,31.260744,121.486797
长宁区云雾山路7号,31.214835,121.407799
徐汇区漕溪北路800号,31.183788,121.435805
浦东新区凌海路80号,31.363404,121.541633
浦东新区紫叶路80弄,31.183371,121.550484
虹口区四川北路818号,31.24799,121.485428
浦东新区芳华路81号,31.194374,121.552226
闵行区曹行支路81弄,31.090865,121.437849
闵行区江川东路830弄,31.006593,121.426983
黄浦区制造局路833弄7号,31.199241,121.485971
浦东新区历城路83弄,31.175394,121.494068
虹口区海伦西路83号,31.260583,121.487917
浦东新区金闻路84号,31.111652,121.774102
静安区陕西北路853号,31.236146,121.448154
松江区古楼公路859弄,31.104501,121.253513
虹口区宝安支路85号,31.264663,121.488151
静安区陕西北路860弄,31.236303,121.448568
宝山区江杨南路880号,31.321316,121.466782
黄浦区徐家汇路88号,31.210967,121.480222
闵行区古美西路899弄,31.130713,121.384105
虹口区海伦西路89号,31.259277,121.483843
徐汇区桂平支路8号,31.145997,121.413607
松江区石湖新路90弄,30.985926,121.121459
宝山区长江西路915号,31.340943,121.46429
崇明区陈彷公路91号,31.498555,121.807346
松江区涞亭南路91号,31.143867,121.333791
虹口区四川北路928号,31.250569,121.484743
虹口区四川北路930号,31.250519,121.484797
虹口区四川北路934号,31.250588,121.484774
杨浦区包头南路93号,31.297742,121.540863
虹口区海伦西路93号,31.259307,121.483742
长宁区中山西路945弄,31.200541,121.413453
静安区延安中路955弄,31.221322,121.452032
浦东新区高斯路965弄,31.201839,121.611545
静安区北宝兴路96号,31.271709,121.466593
静安区共和新路970弄,31.259142,121.461047
浦东新区花山路978弄,31.3496,121.58166
黄浦区成都北路988弄,31.239717,121.464189
静安区东宝兴路998号,31.26509,121.472173
宝山区长江西路999号,31.340157,121.461405
浦东新区潮乐路999弄,30.864123,121.851576
虹口区新市南路999弄,31.296759,121.481392
黄浦区黄家阙路99号,31.214931,121.487996
徐汇区零陵北路9弄,31.196383,121.465201
黄浦区成都南路l32弄,31.222921,121.467391
浦东新区曹家油车,31.277622,121.641983
青浦区老朱枫公路,31.011074,121.043571
黄浦区中山南一路1018号,31.195471,121.472683
浦东新区浦红西路10号,31.087408,121.761065
浦东新区川环南路1115弄,31.18765,121.70111
浦东新区杨高南路1126号,31.206479,121.53022
浦东新区博山东路112弄,31.249208,121.563366
黄浦区西凌家宅路121号,31.204286,121.48583
浦东新区草高支路1255号,31.34967,121.562222
浦东新区南六公路1606号,31.11819,121.700858
浦东新区浦东南路1650弄,31.21927,121.518545
黄浦区中山南一路1711弄,31.201192,121.488264
黄浦区中山南一路1O16号,31.201192,121.488264
宝山区祁北东路临1号,31.428967,121.372017
浦东新区金桥横街201号,31.252786,121.591034
浦东新区周祝公路2376号,31.116218,121.698482
浦东新区浦东南路2380弄,31.199623,121.511702
浦东新区人民东路2437弄,31.048191,121.778168
浦东新区浦东大道2507号,31.258861,121.558509
虹口区东体育会路27号,31.281236,121.488414
黄浦区中山南一路300号,31.200027,121.486055
浦东新区高科西路3050弄,31.189513,121.563621
浦东新区拱极东路3136弄,31.053893,121.794322
浦东新区创新西路333号,31.199766,121.652511
虹口区东体育会路355弄,31.276528,121.484379
虹口区东体育会路359号,31.276949,121.484265
浦东新区三宣公路397弄,30.993134,121.753815
黄浦区先棉祠北弄39号,31.217823,121.491271
浦东新区川周公路4387号,31.119138,121.578439
浦东新区高东二路47弄,31.325295,121.623094
浦东新区听潮南路509弄,31.028044,121.74232
黄浦区西凌家宅路567弄,31.204409,121.487336
浦东新区杨高北路610弄,31.344241,121.587994
浦东新区洋泾镇路61号工地生活区,31.241342,121.550084
虹口区东体育会路65弄,31.278392,121.485547
黄浦区先棉祠北弄68号,31.217442,121.490686
青浦区外青松公路6999弄,31.14088,121.128463
杨浦区齐齐哈尔路88号,31.255627,121.532591
浦东新区航兴北路95弄,31.027149,121.59524
浦东新区环湖北三路403号,30.913163,121.925154
奉贤区青村镇人民路445弄,30.927574,121.580418
浦东新区花园石桥路66号,31.234107,121.502327
浦东新区东三里桥路67号,31.194,121.52325
虹口区东体育会支路85号,31.273832,121.480872
浦东新区东海村王家宅,31.166252,121.680159
浦东新区东滨村黄家宅,31.182043,121.57091
浦东新区八灶村滕家宅,31.153034,121.715706
浦东新区凌桥村赵家浜,31.366587,121.538248
浦东新区前进村沈家宅,31.202485,121.639736
浦东新区友谊村顾家宅,31.204419,121.715223
浦东新区向东村徐家宅,31.233344,121.743897
浦东新区启明村毛家弄,31.276702,121.692665
浦东新区和平村万家宅,30.985554,121.841661
浦东新区城南村龚家宅,31.187777,121.699489
浦东新区大星村杨家宅,31.222013,121.72174
浦东新区奚家村奚家宅,31.156231,121.550453
浦东新区庆星村土家宅,31.234509,121.719111
浦东新区庆星村费家宅,31.157575,121.743493
浦东新区新丰村凤家宅,31.120307,121.555807
浦东新区新浜村鲍家宅,31.122291,121.745246
浦东新区星火村黄家圈,31.257029,121.706332
浦东新区杜尹村唐家宅,31.161386,121.582882
浦东新区杜尹村杨家宅,31.161738,121.746539
浦东新区柴场村饶家宅,31.197709,121.727166
浦东新区栏杆村奚家宅,31.172247,121.666435
浦东新区民丰村严家宅,31.170615,121.553255
浦东新区永丰村苏家宅,31.184798,121.570671
浦东新区永新村海家宅,31.306089,121.662789
浦东新区湾镇村吴家宅,31.179955,121.631647
浦东新区环东村郭家宅,31.186553,121.659235
浦东新区益民村周家宅,31.220096,121.716101
浦东新区直属村太平宅,31.219029,121.761436
浦东新区红星村杨家宅,31.089179,121.771497
浦东新区胜利村张家宅,31.217604,121.68654
浦东新区营前村毛家宅,31.299315,121.656263
浦东新区虹桥村瞿家宅,31.17567,121.710371
浦东新区迅建村王家宅,31.166252,121.680159
浦东新区道新村龚家宅,31.162963,121.759373
浦东新区陈胡村吴家宅,31.179955,121.631647
浦东新区陈行村张家宅,31.483281,121.342539
浦东新区青四村吴家宅,31.179955,121.631647
浦东新区黄楼村徐家宅,31.208345,121.706999
浦东新区黄楼村曹家宅,31.16461,121.627178
闵行区务本路建设工地,31.099657,121.417367
闵行区莘南花苑一街坊,31.111066,121.395714
青浦区华徐公路振泾路,31.166726,121.274122
嘉定区嘉好路银裕路路口,31.300532,121.259774
浦东新区七灶村邱俞家宅,31.137018,121.711764
浦东新区中林村小中林队,31.140068,121.507683
浦东新区勤俭村北杨家宅,31.206702,121.727353
浦东新区勤俭村北陆家宅,31.206581,121.727492
浦东新区友谊村西凌家宅,31.101995,121.693879
浦东新区合庆镇跃进新村,31.207974,121.704837
浦东新区小湾村第二新村,31.231397,121.689288
浦东新区新春村东姚家宅,31.09984,121.65865
浦东新区机口村河东南宅,31.205333,121.673794
浦东新区栏杆村康顾家宅,31.175997,121.664142
浦东新区民丰村奚龚家宅,31.20833,121.642079
浦东新区民丰村西龚家宅,31.20833,121.642079
浦东新区海塘村小蔡家宅,31.302656,121.647587
浦东新区牌楼村西曹家宅,30.983103,121.603698
浦东新区界龙村王范家宅,31.1761,121.676748
浦东新区界龙村西王家宅,31.160996,121.686979
浦东新区竞赛村小徐家宅,31.302342,121.650528
浦东新区营房村高路三宅,31.210609,121.735499
浦东新区虹一村东丁家宅,31.089088,121.766396
浦东新区道新村西杜家宅,31.162963,121.759373
浦东新区邓镇二村付家宅,31.00249,121.82495
浦东新区顾三村蔡西家宅,31.294745,121.67628
浦东新区高东镇东孙家沟,31.202862,121.754296
浦东新区望楼三村西唐家宅,31.235292,121.559653
浦东新区金光村朱尤陆家宅,31.296341,121.635104
浦东新区韩荡村烧盐曹家宅,31.155943,121.606809
浦东新区中界村复兴队沈家宅,31.187785,121.57172
浦东新区勤奋村冯桥队张家宅,31.26077,121.721603
浦东新区勤奋村勤奋队卫家宅,31.26077,121.721603
浦东新区南阜村红光队顾家宅,31.130501,121.517502
浦东新区张江镇中心村奚家宅,31.172247,121.666435
浦东新区栏杆村孙家队徐家宅,31.208345,121.706999
浦东新区联丰村南沈队沈家墙,31.153601,121.512721
浦东新区南阜村高树队北孙家宅,31.133543,121.520482
浦东新区金光村陆家湾队陆家湾,31.136052,121.516675
浦东新区天花庵村南陈大队陈家宅,31.122274,121.523011
浦东新区懿德村小陈家队小陈家宅,31.118558,121.518155
浦东新区上南路浦三路交界口工地生活区,31.07205,121.514089
浦东新区康意路康花路交界口工地生活区,31.204722,121.548595
浦东新区栖山路民生路交界口工地生活区,31.204722,121.548595
浦东新区华夏东路齐友路交界口工地生活区,31.153886,121.480264
浦东新区川周公路凌空路交界口工地生活区,31.18398,121.725203
金山区油车,30.847018,121.296491
嘉定区周泾村,31.337772,121.154621
嘉定区外冈村,31.36018,121.171181
普陀区糖坊街,31.247973,121.404571
松江区小涨泾,30.998075,121.242478
松江区新浜村,30.924692,121.067396
松江区新镇村,31.087249,121.134897
松江区榆树头,31.004364,121.23264
金山区秀洲村,30.906731,121.17261
闵行区东新街,31.03025,121.370646
闵行区为民村,31.11115,121.50677
闵行区望海村,31.016939,121.342577
闵行区车沟村,31.083433,121.457288
闵行区鹫山村,31.243809,121.250199
青浦区万隆村,31.105565,121.080172
青浦区南门街,31.143133,121.113342
青浦区莲龚路,31.033443,120.973048
青浦区金南路,31.031103,120.919143
闵行区繁兴路1000弄,31.220081,121.290155
徐汇区新乐路100弄,31.218145,121.454802
青浦区美周路101弄,31.10869,121.054762
嘉定区丰登路1028弄,31.359153,121.285591
嘉定区华江路1028号,31.231947,121.324429
虹口区同心路1035弄,31.274266,121.468885
闵行区古美路1036号,31.153981,121.401619
杨浦区控江路103号,31.288378,121.547426
黄浦区学院路104号,31.223104,121.495327
宝山区岭南路1050弄,31.320894,121.456351
松江区新镇街1058弄,31.066628,121.315412
静安区临汾路1060弄,31.311232,121.445473
闵行区古美路1068弄,31.155905,121.402184
宝山区南大路106弄,31.299836,121.404513
闵行区顾戴路1075弄,31.139561,121.388916
杨浦区沧州路107弄,31.284287,121.52759
闵行区漕宝路1088号,31.160424,121.399269
静安区长安路1088号,31.246583,121.450925
黄浦区江阴路108号,31.229611,121.468492
杨浦区翔殷路1099号,31.299782,121.5179
长宁区汇川路10弄,31.215394,121.417636
杨浦区兰州路1107号,31.266799,121.526585
虹口区长春路110号,31.259937,121.485975
松江区明强路1111号,31.038703,121.289646
闵行区灯辉路1111号,31.029001,121.410811
徐汇区斜土路1118号,31.200222,121.466255
普陀区长寿路1118号,31.23071,121.42717
徐汇区漕宝路111号,31.167798,121.42453
虹口区华严路111号,31.303942,121.472733
闵行区灯辉路1128号,31.028814,121.408706
闵行区灯辉路1129号,31.028686,121.410787
长宁区北虹路1131号,31.211915,121.376248
长宁区凯旋路1139号,31.20466,121.41815
静安区常熟路113弄,31.217045,121.448885
黄浦区中华路1148弄,31.215137,121.488222
松江区新松路1150弄,31.000239,121.125259
松江区乐都路1155弄,31.013917,121.238423
杨浦区政本路115号,31.291263,121.514657
松江区茸华路1168号,31.040411,121.302841
静安区虬江路1168号,31.250382,121.470362
宝山区松兰路1169弄,31.384766,121.442471
黄浦区黄河路117号,31.234883,121.470429
虹口区沽源路118弄,31.302964,121.477539
闵行区曹联路118号,31.109859,121.43972
松江区影维路11弄,31.014217,121.316256
杨浦区闸殷路1200号,31.323587,121.520474
普陀区江宁路1207号,31.244443,121.44267
长宁区定西路1241号,31.214462,121.422683
徐汇区永嘉路124号,31.209689,121.459768
黄浦区进贤路124号,31.221716,121.459933
闵行区龙茗路1256号,31.143779,121.385272
杨浦区控江路125号,31.287613,121.545651
静安区康定路1268弄,31.230404,121.432257
宝山区四元路126号,31.413308,121.430084
徐汇区永嘉路126号,31.209651,121.459672
静安区中兴路1279弄,31.25293,121.46229
崇明区长凯路128号,31.373625,121.735941
长宁区泉口路128弄,31.213515,121.369244
闵行区瑞丽路128号,31.006013,121.407662
静安区康定路1299弄,31.22961,121.433202
虹口区恒业路129号,31.268426,121.475759
虹口区奎照路12弄,31.300311,121.471135
闵行区水清路1309号,31.131333,121.372922
虹口区乍浦路130弄,31.247307,121.488066
静安区民立路130号,31.245167,121.456001
普陀区常德路1313号,31.2415,121.435385
闵行区兰坪路131弄,31.002633,121.420402
黄浦区牯岭路131号,31.236042,121.471423
奉贤区浦灵路1328号,30.97017,121.40952
闵行区莲花路1328号,31.157348,121.396496
闵行区莲花路1330号,31.159114,121.396283
闵行区华宁路1333弄,31.009968,121.394863
长宁区凯旋路1335号,31.20157,121.41947
静安区中兴路1340弄,31.251747,121.460833
静安区新闸路1340弄,31.232042,121.450657
闵行区黎安路1342号,31.129471,121.371068
嘉定区双单路1353号,31.327787,121.254349
闵行区放鹤路1358弄,31.050473,121.445418
闵行区华江路1368弄,31.22657,121.325818
静安区会文路136号,31.253702,121.472151
虹口区大连路137号,31.254088,121.515758
闵行区平阳路138号,31.134194,121.383272
静安区常德路1393弄,31.241964,121.432247
杨浦区平凉路1399号,31.26502,121.537909
黄浦区东台路139号,31.220042,121.481331
杨浦区许昌路13号,31.256524,121.524955
杨浦区河间路1407号,31.277348,121.55067
闵行区姚安路140号,31.014007,121.437099
闵行区田林路1419号,31.161529,121.382765
闵行区平阳路141号,31.142401,121.406911
黄浦区兴安路141弄,31.220778,121.471153
松江区香亭路1425弄,30.999113,121.291151
宝山区兆南路142号,31.304113,121.400182
杨浦区许昌路1430号,31.269592,121.51532
闵行区黎安路1430号,31.121631,121.351752
闵行区黎安路1432号,31.121606,121.351715
普陀区常德路1436号,31.244278,121.433283
闵行区黎安路1436号,31.12152,121.351513
松江区三浜路143号,31.02915,121.290471
黄浦区大沽路143号,31.226336,121.471453
虹口区山阴路145弄,31.266185,121.484956
虹口区新建路145号,30.801545,121.285179
黄浦区大沽路145号,31.226352,121.471381
徐汇区余庆路146弄,31.200461,121.439667
黄浦区永年路146号,31.21211,121.47874
杨浦区许昌路1483弄,31.270926,121.513122
闵行区富岩路14号,31.028848,121.371907
嘉定区叶城路1500弄,31.360417,121.238295
虹口区广粤路1500号,31.304158,121.468622
闵行区恒南路1501弄,31.0883,121.512354
嘉定区清河路150号,31.382947,121.243493
杨浦区锦西路150弄,31.273601,121.508072
虹口区广粤路150弄,31.286408,121.46797
虹口区丰镇路151弄,31.304196,121.474777
黄浦区紫霞路151号,31.218642,121.501073
黄浦区南昌路152号,31.218739,121.467407
黄浦区江阴路152号,31.229423,121.467854
杨浦区控江路1531号,31.275398,121.520767
闵行区北翟路1551号,31.223083,121.341167
杨浦区大连路1556号,31.273967,121.50273
普陀区桃浦路1559号,31.262148,121.372855
虹口区广粤路155号,31.283963,121.465338
黄浦区黄河路155号,31.23551,121.470125
闵行区莘西路156弄,31.102993,121.374807
黄浦区江阴路157号,31.229268,121.467633
普陀区金通路158号,31.282554,121.343321
闵行区贵都路158弄,31.080219,121.400358
徐汇区龙吴路1591号,31.135741,121.452844
黄浦区福州路159弄,31.232677,121.478757
长宁区安顺路15号,31.200744,121.415428
闵行区莘中路15弄,31.106865,121.3791
闵行区苏召路1601号,31.100173,121.535937
虹口区广粤路1607号,31.304899,121.467381
闵行区吴宝路160弄,31.159044,121.35019
青浦区中泽苑160弄,31.138916,121.170703
宝山区顾荻路161弄,31.352894,121.389545
黄浦区尚文路161号,31.215648,121.491003
闵行区纪翟路1625弄,31.234752,121.275222
黄浦区兴安路163弄,31.220898,121.470389
长宁区华阳路164号,31.223396,121.422131
闵行区都市路165弄,31.031583,121.423497
静安区巨鹿路165号,31.222841,121.4653
虹口区沙泾路166号,31.256613,121.492503
普陀区双山路167弄,31.262564,121.423601
徐汇区龙吴路1688号,31.132922,121.454929
徐汇区安福路168号,31.214482,121.444312
杨浦区鞍山路168弄,31.27411,121.513012
闵行区保乐路168弄,31.206736,121.28958
闵行区北华路168弄,31.228199,121.329908
闵行区申北路168弄,31.091734,121.384508
闵行区龙茗路1693号,31.151738,121.382401
杨浦区内江路169弄,31.285358,121.544162
闵行区虹莘路1701弄,31.131271,121.382888
青浦区三星街172弄,31.197263,121.228925
闵行区沪闵路1738号,31.029925,121.413587
嘉定区梅川路1788号,31.249128,121.371993
宝山区华灵路1788弄,31.277973,121.408768
宝山区真陈路1799号,31.298242,121.346365
虹口区奎照路17弄,31.300311,121.471135
静安区长临路181号,31.327361,121.434103
静安区富民路182弄,31.218002,121.451244
虹口区武进路183号,31.25269,121.487048
徐汇区华山路1845号,31.199443,121.436801
嘉定区崇文路1851弄,31.322337,121.260001
宝山区杨北路185号,31.392973,121.411179
嘉定区云屏路188弄,31.327716,121.25511
闵行区莘沥路188弄,31.111556,121.372194
闵行区黄坪路188号,31.013505,121.380321
徐汇区虹桥路189号,31.193546,121.433048
长宁区长顺路18号,31.198165,121.417641
闵行区瑞丽路18号,31.002704,121.408715
青浦区三元路18弄,31.148181,121.109628
黄浦区大兴街18号,31.213476,121.48849
杨浦区开鲁路190号,31.324917,121.540111
虹口区广中路191弄,31.2744,121.47453
徐汇区龙吴路1944号,31.129447,121.455926
闵行区联航路1969号,31.07662,121.510598
宝山区新沪路197弄,31.26829,121.417865
长宁区哈密路1999弄,31.193095,121.369375
松江区银圩路199弄,30.980678,121.250414
青浦区漕程路199弄,31.140195,121.096136
虹口区丰镇路19号,31.304591,121.480423
闵行区镇企路1号,31.150095,121.356386
静安区安远路1号,31.242613,121.449808
松江区文诚路2000弄,31.02765,121.186444
普陀区光新路200弄,31.252987,121.432436
闵行区江桦路200弄,31.105783,121.497513
徐汇区永康路201号,31.209507,121.454601
静安区会文路201弄,31.253539,121.470813
